{
  "name": "banyaanTree",
  "tenantFieldName": "instituteId",
  "tenantDbName": "institute_id",
  "maxLengthForTextField": 199,
  "valueLists": {
    "instituteList": {
      "listType": "runtime",
      "dbTableName": "institutes",
      "dbColumn1": "institute_id",
      "valueIsNumeric": true,
      "dbColumn2": "name",
      "keyColumn": "trust_id",
      "keyIsNumeric": true,
      "activeColumn": "is_active"
    },
    "departmentList": {
      "listType": "runtime",
      "dbTableName": "departments",
      "dbColumn1": "department_id",
      "valueIsNumeric": true,
      "dbColumn2": "name",
      "activeColumn": "is_active",
      "tenantColumn": "institute_id"
    },
    "designationList": {
      "listType": "runtime",
      "dbTableName": "designations",
      "dbColumn1": "designation_id",
      "valueIsNumeric": true,
      "dbColumn2": "name",
      "activeColumn": "is_active",
      "tenantColumn": "institute_id"
    },
    "degreeList": {
      "listType": "runtime",
      "dbTableName": "degrees",
      "dbColumn1": "degree_id",
      "valueIsNumeric": true,
      "dbColumn2": "name",
      "activeColumn": "is_active",
      "tenantColumn": "institute_id"
    },
    "allSubjectList": {
      "listType": "runtime",
      "dbTableName": "all_subject_list",
      "dbColumn1": "offered_subject_id",
      "valueIsNumeric": true,
      "dbColumn2": "name",
      "keyColumn": "department_id",
      "keyIsNumeric": true,
      "tenantColumn": "institute_id"
    },
    "offeredSubjectList": {
      "listType": "runtime",
      "dbTableName": "offered_subject_list",
      "dbColumn1": "offered_subject_id",
      "valueIsNumeric": true,
      "dbColumn2": "name",
      "keyColumn": "department_id",
      "keyIsNumeric": true,
      "tenantColumn": "institute_id"
    },
    "taughtSubjectList": {
      "listType": "runtime",
      "dbTableName": "taught_subject_list",
      "dbColumn1": "offered_subject_id",
      "valueIsNumeric": true,
      "dbColumn2": "name",
      "keyColumn": "department_id",
      "keyIsNumeric": true,
      "tenantColumn": "institute_id"
    },
    "programList": {
      "listType": "runtime",
      "dbTableName": "programs",
      "dbColumn1": "program_id",
      "valueIsNumeric": true,
      "dbColumn2": "name",
      "keyColumn": "department_id",
      "keyIsNumeric": true,
      "activeColumn": "is_active",
      "tenantColumn": "institute_id"
    },
    "subjectTypeList": {
      "listType": "runtime",
      "dbTableName": "subject_types",
      "dbColumn1": "subject_type_id",
      "valueIsNumeric": true,
      "dbColumn2": "name",
      "activeColumn": "is_active",
      "tenantColumn": "institute_id"
    },
    "levelList": {
      "listType": "runtime",
      "dbTableName": "levels",
      "dbColumn1": "level_id",
      "valueIsNumeric": true,
      "dbColumn2": "name",
      "keyColumn": "degree_id",
      "keyIsNumeric": true
    },
    "programLevelList": {
      "listType": "runtime",
      "dbTableName": "program_levels",
      "dbColumn1": "level_id",
      "valueIsNumeric": true,
      "dbColumn2": "name",
      "keyColumn": "program_id",
      "keyIsNumeric": true
    },
    "sectionList": {
      "listType": "runtime",
      "dbTableName": "sections",
      "dbColumn1": "section_id",
      "valueIsNumeric": true,
      "dbColumn2": "name",
      "activeColumn": "is_active"
    },
    "levelSectionList": {
      "listType": "runtime",
      "dbTableName": "level_section_details",
      "dbColumn1": "level_section_id",
      "valueIsNumeric": true,
      "dbColumn2": "name",
      "keyColumn": "level_id",
      "keyIsNumeric": true,
      "activeColumn": "is_active"
    },
    "roleList": {
      "listType": "runtime",
      "dbTableName": "roles",
      "dbColumn1": "role_id",
      "valueIsNumeric": true,
      "dbColumn2": "role_name",
      "activeColumn": "is_active",
      "tenantColumn": "institute_id"
    },
    "seasonList": {
      "listType": "runtime",
      "dbTableName": "seasons",
      "dbColumn1": "season_id",
      "valueIsNumeric": true,
      "dbColumn2": "name",
      "activeColumn": "is_active",
      "tenantColumn": "institute_id"
    },
    "assessmentSchemeList": {
      "listType": "runtime",
      "dbTableName": "assessment_schemes",
      "dbColumn1": "assessment_scheme_id",
      "valueIsNumeric": true,
      "dbColumn2": "name",
      "tenantColumn": "institute_id"
    },
    "assessmentItemList": {
      "listType": "runtime",
      "dbTableName": "assessment_items",
      "dbColumn1": "seq_no",
      "valueIsNumeric": true,
      "dbColumn2": "name",
      "keyColumn": "assessment_scheme_id",
      "keyIsNumeric": true,
      "tenantColumn": "institute_id"
    },
    "subjectSectionList": {
      "listType": "runtime",
      "dbTableName": "subject_section_list",
      "dbColumn1": "subject_section_id",
      "valueIsNumeric": true,
      "dbColumn2": "name",
      "keyColumn": "offered_subject_id",
      "keyIsNumeric": true
    },
    "evaluatorList": {
      "listType": "runtime",
      "dbTableName": "evaluators",
      "dbColumn1": "evaluator_id",
      "valueIsNumeric": true,
      "dbColumn2": "name",
      "keyColumn": "offered_subject_id",
      "keyIsNumeric": true,
      "tenantColumn": "institute_id"
    },
    "accountStatus": {
      "listType": "simple",
      "list": [
        {
          "value": "Active",
          "label": "Active"
        },
        {
          "value": "Suspended",
          "label": "Suspended"
        },
        {
          "value": "Closed",
          "label": "Closed"
        }
      ]
    },
    "userType": {
      "listType": "runtime",
      "list": [
        {
          "value": "student",
          "label": "student"
        },
        {
          "value": "staff",
          "label": "staff"
        },
        {
          "value": "admin",
          "label": "admin"
        },
        {
          "value": "guardian",
          "label": "guardian"
        },
        {
          "value": "trustee",
          "label": "trustee"
        }
      ]
    },
    "instituteType": {
      "listType": "simple",
      "list": [
        {
          "value": "DSERTPS",
          "label": "Karnataka State Syllabus Primary School"
        },
        {
          "value": "DSERTPHS",
          "label": "Karnataka State Syllabus Higher School"
        },
        {
          "value": "CBSE ",
          "label": "CBSE"
        },
        {
          "value": "ENG_A_VTU",
          "label": "Engineering College (Automonus Under VTU)"
        },
        {
          "value": "ENG_VTU",
          "label": "Engineering College ( VTU)"
        }
      ]
    },
    "admissionQuota": {
      "listType": "simple",
      "list": [
        {
          "value": "CET",
          "label": "CET"
        },
        {
          "value": "COMEDK",
          "label": "COMEDK"
        },
        {
          "value": "CETSNQ",
          "label": "CET-SNQ"
        },
        {
          "value": "MANG",
          "label": "MANAGEMENT"
        },
        {
          "value": "NRI",
          "label": "NRI"
        },
        {
          "value": "GOI",
          "label": "GOI"
        },
        {
          "value": "Other",
          "label": "Other"
        }
      ]
    },
    "religion": {
      "listType": "simple",
      "list": [
        {
          "value": "Hindu",
          "label": "Hindu"
        },
        {
          "value": "Muslim",
          "label": "Muslim"
        },
        {
          "value": "Christian",
          "label": "Christian"
        },
        {
          "value": "Sikh",
          "label": "Sikh"
        },
        {
          "value": "Jain",
          "label": "Jain"
        },
        {
          "value": "Others",
          "label": "Other"
        }
      ]
    },
    "relationType": {
      "listType": "simple",
      "list": [
        {
          "value": "Mother",
          "label": "Mother"
        },
        {
          "value": "Father",
          "label": "Father"
        },
        {
          "value": "Legal Guardian",
          "label": "Legal Guardian"
        }
      ]
    },
    "documentType": {
      "listType": "simple",
      "list": [
        {
          "value": "Marks Card",
          "label": "Marks Card"
        },
        {
          "value": "Certificate",
          "label": "Ceritifcate (e.g: Birth Certificate etc)"
        },
        {
          "value": "Photo",
          "label": "Photo"
        },
        {
          "value": "Govt Id",
          "label": "Govt Id(e.g.: Passport, DL etc)"
        }
      ]
    },
    "domicileState": {
      "listType": "simple",
      "list": [
        {
          "value": "Karnataka",
          "label": "Karnataka"
        },
        {
          "value": "Non-Karnataka",
          "label": "Non-Karnataka"
        },
        {
          "value": "Foreign",
          "label": "Foreign"
        }
      ]
    },
    "gender": {
      "listType": "simple",
      "list": [
        {
          "value": "Male",
          "label": "Male"
        },
        {
          "value": "Female",
          "label": "Female"
        },
        {
          "value": "Others",
          "label": "Others"
        },
        {
          "value": "Not Applicable",
          "label": "Not Applicable"
        }
      ]
    },
    "bloodGroup": {
      "listType": "simple",
      "list": [
        {
          "value": "O -ve",
          "label": "O -ve"
        },
        {
          "value": "O +ve",
          "label": "O +ve"
        },
        {
          "value": "A -ve",
          "label": "A -ve"
        },
        {
          "value": "A +ve",
          "label": "A +ve"
        },
        {
          "value": "B -ve",
          "label": "B -ve"
        },
        {
          "value": "B +ve",
          "label": "B +ve"
        },
        {
          "value": "AB -ve",
          "label": "AB -ve"
        },
        {
          "value": "AB +ve",